category,title,creator,publication_year,description,votes_count
album,Blue Breaker,Dr. Sarai Langosh,1949,Et et expedita non aut quo.,0
book,Joe Treat,Blaise Lesch,1968,Voluptatem adipisci qui velit.,0
album,Kreb-Full-o Been,Ms. Trevion Buckridge,2016,Vero consectetur delectus consequatur id aut accusantium unde excepturi.,0
album,Wake-up Pie,Timmy Streich I,1919,Voluptatem consequatur qui consectetur nisi officiis culpa.,0
album,Major Cup,Jayde Bartoletti,1944,Quis recusandae cum est facere consequatur minima magni et.,0
book,Summer Select,Ms. Gwendolyn Ortiz,1946,Et molestiae eos nam odit aut sed.,0
album,Holiday Choice,Alexandria Lehner,1940,Excepturi voluptas ut voluptatum.,0
book,Postmodern Blend,Meredith Brekke,1970,Dolorem fugit accusantium qui.,0
book,Green Forrester,Raquel Hirthe,1933,Omnis qui quia odio.,0
album,Winter Mug,Tia Weissnat II,1990,Laboriosam autem iusto quae sed voluptate et.,0
book,Red Pie,Davon Kub,1961,Id dolorem qui laborum quia.,0
album,Major Equinox,Queen Satterfield,1997,Fugit perferendis est quam sunt porro vel rerum.,0
book,Melty Breaker,Montana Dickinson Sr.,1991,Perferendis harum fuga corporis.,0
book,Winter Pie,Mr. Syble Kuhn,1970,Incidunt molestias deserunt laudantium.,0
album,Goodbye Utopia,Orion Spencer,1962,Praesentium enim pariatur voluptatem sed quod dolorum.,0
album,Green Select,Berneice Jenkins,1957,Hic repudiandae molestiae id nulla aliquid maiores necessitatibus.,0
book,Blacktop Enlightenment,Seamus D'Amore,1928,Ea id cumque et pariatur magni nemo dolorem.,0
album,Express Extract,Dorothy Jast I,1969,Dolores dolorum aut ea aperiam et voluptatem.,0
album,Winter Been,Mackenzie Wilkinson,1932,Culpa repudiandae et at sint et amet fugiat et.,0
book,Heart Mug,Orpha Douglas,2009,Qui voluptas alias quia.,0
album,Blue Treat,Eliseo Gorczany,1979,Sit est quis veniam saepe.,0
book,Hello Town,Laury Walter,2005,Est sed ut asperiores sed fugiat.,0
album,Blacktop Choice,Casey Feil,2008,Temporibus ex maxime labore quam et natus quia ipsum.,0
book,Huggy Star,Nigel Lesch DVM,1962,Voluptatem ea aspernatur nesciunt ipsa quis error corporis placeat.,0
